{
  "name": "generate_tests",
  "description": "Generate unit, integration, or end-to-end tests for a given code snippet or function. Infers the testing framework from the language and project context when not specified. Returns ready-to-run test code with descriptive test names and inline comments.",
  "parameters": {
    "type": "object",
    "properties": {
      "code": {
        "type": "string",
        "description": "The source code (function, class, or module) to generate tests for."
      },
      "language": {
        "type": "string",
        "description": "Programming language of the source code (e.g. 'python', 'typescript', 'java', 'go')."
      },
      "test_type": {
        "type": "string",
        "enum": ["unit", "integration", "e2e", "snapshot", "property-based"],
        "description": "The kind of tests to generate. Defaults to 'unit'.",
        "default": "unit"
      },
      "framework": {
        "type": "string",
        "description": "Testing framework to use (e.g. 'pytest', 'jest', 'junit', 'go test'). Inferred from language when omitted."
      },
      "coverage_targets": {
        "type": "array",
        "items": { "type": "string" },
        "description": "Specific scenarios or edge cases that must be covered (e.g. 'empty input', 'null values', 'concurrent access')."
      },
      "include_mocks": {
        "type": "boolean",
        "description": "Whether to generate mocks or stubs for external dependencies.",
        "default": true
      }
    },
    "required": ["code", "language"],
    "additionalProperties": false
  },
  "returns": {
    "type": "object",
    "description": "Generated test code along with metadata about what was produced.",
    "properties": {
      "test_code": {
        "type": "string",
        "description": "The complete, runnable test file content."
      },
      "framework_used": {
        "type": "string",
        "description": "The testing framework used."
      },
      "test_cases": {
        "type": "array",
        "items": { "type": "string" },
        "description": "List of test case names that were generated."
      },
      "notes": {
        "type": "string",
        "description": "Any caveats, assumptions, or setup instructions."
      }
    }
  },
  "examples": [
    {
      "description": "Generate pytest unit tests for a Python function",
      "input": {
        "code": "def divide(a: float, b: float) -> float:\n    if b == 0:\n        raise ValueError('Cannot divide by zero')\n    return a / b",
        "language": "python",
        "test_type": "unit",
        "coverage_targets": ["zero division", "negative numbers", "float precision"]
      },
      "output": {
        "test_code": "import pytest\nfrom module import divide\n\ndef test_divide_positive_numbers():\n    assert divide(10, 2) == 5.0\n\ndef test_divide_negative_numbers():\n    assert divide(-6, 3) == -2.0\n\ndef test_divide_float_precision():\n    assert divide(1, 3) == pytest.approx(0.333, rel=1e-3)\n\ndef test_divide_by_zero_raises():\n    with pytest.raises(ValueError, match='Cannot divide by zero'):\n        divide(5, 0)\n",
        "framework_used": "pytest",
        "test_cases": [
          "test_divide_positive_numbers",
          "test_divide_negative_numbers",
          "test_divide_float_precision",
          "test_divide_by_zero_raises"
        ],
        "notes": "Ensure the module containing `divide` is importable from the test file."
      }
    }
  ],
  "tags": ["testing", "test-generation", "unit-test", "integration-test", "e2e"],
  "version": "1.0.0"
}
